2021-03-12 15:58:49.494511 IP cpef81d0faec973-cmf81d0faec970.cpe.net.cable.rogers.com.49257 > 143.110.210.112.ssh: Flags [.], ack 8120848, win 2030, length 0
2021-03-12 15:58:49.494520 IP cpef81d0faec973-cmf81d0faec970.cpe.net.cable.rogers.com.49257 > 143.110.210.112.ssh: Flags [.], ack 8124368, win 2017, length 0
2021-03-12 15:58:49.494530 IP cpef81d0faec973-cmf81d0faec970.cpe.net.cable.rogers.com.49257 > 143.110.210.112.ssh: Flags [.], ack 8127228, win 2005, length 0
2021-03-12 15:58:49.494736 IP 143.110.210.112.ssh > cpef81d0faec973-cmf81d0faec970.cpe.net.cable.rogers.com.49257: Flags [P.], seq 8205108:8208664, ack 3817, win 501, length 3556
2021-03-12 15:58:49.494783 IP 143.110.210.112.ssh > cpef81d0faec973-cmf81d0faec970.cpe.net.cable.rogers.com.49257: Flags [P.], seq 8208664:8208884, ack 3817, win 501, length 220
2021-03-12 15:58:49.494824 IP 143.110.210.112.ssh > cpef81d0faec973-cmf81d0faec970.cpe.net.cable.rogers.com.49257: Flags [P.], seq 8208884:8209104, ack 3817, win 501, length 220
2021-03-12 15:58:49.494865 IP 143.110.210.112.ssh > cpef81d0faec973-cmf81d0faec970.cpe.net.cable.rogers.com.49257: Flags [P.], seq 8209104:8209324, ack 3817, win 501, length 220
2021-03-12 15:58:49.494906 IP 143.110.210.112.ssh > cpef81d0faec973-cmf81d0faec970.cpe.net.cable.rogers.com.49257: Flags [P.], seq 8209324:8209544, ack 3817, win 501, length 220
2021-03-12 15:58:49.494946 IP 143.110.210.112.ssh > cpef81d0faec973-cmf81d0faec970.cpe.net.cable.rogers.com.49257: Flags [P.], seq 8209544:8209764, ack 3817, win 501, length 220
2021-03-12 15:58:49.494987 IP 143.110.210.112.ssh > cpef81d0faec973-cmf81d0faec970.cpe.net.cable.rogers.com.49257: Flags [P.], seq 8209764:8209984, ack 3817, win 501, length 220
2021-03-12 15:58:49.495027 IP 143.110.210.112.ssh > cpef81d0faec973-cmf81d0faec970.cpe.net.cable.rogers.com.49257: Flags [P.], seq 8209984:8210204, ack 3817, win 501, length 220
2021-03-12 15:58:49.495066 IP 143.110.210.112.ssh > cpef81d0faec973-cmf81d0faec970.cpe.net.cable.rogers.com.49257: Flags [P.], seq 8210204:8210424, ack 3817, win 501, length 220
2021-03-12 15:58:49.495107 IP 143.110.210.112.ssh > cpef81d0faec973-cmf81d0faec970.cpe.net.cable.rogers.com.49257: Flags [P.], seq 8210424:8210644, ack 3817, win 501, length 220
2021-03-12 15:58:49.495147 IP 143.110.210.112.ssh > cpef81d0faec973-cmf81d0faec970.cpe.net.cable.rogers.com.49257: Flags [P.], seq 8210644:8210864, ack 3817, win 501, length 220
2021-03-12 15:58:49.495186 IP 143.110.210.112.ssh > cpef81d0faec973-cmf81d0faec970.cpe.net.cable.rogers.com.49257: Flags [P.], seq 8210864:8211084, ack 3817, win 501, length 220
2021-03-12 15:58:49.495226 IP 143.110.210.112.ssh > cpef81d0faec973-cmf81d0faec970.cpe.net.cable.rogers.com.49257: Flags [P.], seq 8211084:8211304, ack 3817, win 501, length 220
2021-03-12 15:58:49.495284 IP 143.110.210.112.ssh > cpef81d0faec973-cmf81d0faec970.cpe.net.cable.rogers.com.49257: Flags [P.], seq 8211304:8211524, ack 3817, win 501, length 220
2021-03-12 15:58:49.495325 IP 143.110.210.112.ssh > cpef81d0faec973-cmf81d0faec970.cpe.net.cable.rogers.com.49257: Flags [P.], seq 8211524:8211744, ack 3817, win 501, length 220
2021-03-12 15:58:49.495396 IP 143.110.210.112.ssh > cpef81d0faec973-cmf81d0faec970.cpe.net.cable.rogers.com.49257: Flags [P.], seq 8211744:8211964, ack 3817, win 501, length 220
2021-03-12 15:58:49.495436 IP 143.110.210.112.ssh > cpef81d0faec973-cmf81d0faec970.cpe.net.cable.rogers.com.49257: Flags [P.], seq 8211964:8212184, ack 3817, win 501, length 220
2021-03-12 15:58:49.495477 IP 143.110.210.112.ssh > cpef81d0faec973-cmf81d0faec970.cpe.net.cable.rogers.com.49257: Flags [P.], seq 8212184:8212404, ack 3817, win 501, length 220
2021-03-12 15:58:49.495527 IP 143.110.210.112.ssh > cpef81d0faec973-cmf81d0faec970.cpe.net.cable.rogers.com.49257: Flags [P.], seq 8212404:8212624, ack 3817, win 501, length 220
2021-03-12 15:58:49.495566 IP 143.110.210.112.ssh > cpef81d0faec973-cmf81d0faec970.cpe.net.cable.rogers.com.49257: Flags [P.], seq 8212624:8212844, ack 3817, win 501, length 220
2021-03-12 15:58:49.495606 IP 143.110.210.112.ssh > cpef81d0faec973-cmf81d0faec970.cpe.net.cable.rogers.com.49257: Flags [P.], seq 8212844:8213064, ack 3817, win 501, length 220
2021-03-12 15:58:49.495646 IP 143.110.210.112.ssh > cpef81d0faec973-cmf81d0faec970.cpe.net.cable.rogers.com.49257: Flags [P.], seq 8213064:8213284, ack 3817, win 501, length 220
2021-03-12 15:58:49.495686 IP 143.110.210.112.ssh > cpef81d0faec973-cmf81d0faec970.cpe.net.cable.rogers.com.49257: Flags [P.], seq 8213284:8213504, ack 3817, win 501, length 220
2021-03-12 15:58:49.495725 IP 143.110.210.112.ssh > cpef81d0faec973-cmf81d0faec970.cpe.net.cable.rogers.com.49257: Flags [P.], seq 8213504:8213724, ack 3817, win 501, length 220
2021-03-12 15:58:49.495765 IP 143.110.210.112.ssh > cpef81d0faec973-cmf81d0faec970.cpe.net.cable.rogers.com.49257: Flags [P.], seq 8213724:8213944, ack 3817, win 501, length 220
2021-03-12 15:58:49.495804 IP 143.110.210.112.ssh > cpef81d0faec973-cmf81d0faec970.cpe.net.cable.rogers.com.49257: Flags [P.], seq 8213944:8214164, ack 3817, win 501, length 220
2021-03-12 15:58:49.495844 IP 143.110.210.112.ssh > cpef81d0faec973-cmf81d0faec970.cpe.net.cable.rogers.com.49257: Flags [P.], seq 8214164:8214384, ack 3817, win 501, length 220
2021-03-12 15:58:49.495883 IP 143.110.210.112.ssh > cpef81d0faec973-cmf81d0faec970.cpe.net.cable.rogers.com.49257: Flags [P.], seq 8214384:8214604, ack 3817, win 501, length 220
2021-03-12 15:58:49.495923 IP 143.110.210.112.ssh > cpef81d0faec973-cmf81d0faec970.cpe.net.cable.rogers.com.49257: Flags [P.], seq 8214604:8214824, ack 3817, win 501, length 220
2021-03-12 15:58:49.495963 IP 143.110.210.112.ssh > cpef81d0faec973-cmf81d0faec970.cpe.net.cable.rogers.com.49257: Flags [P.], seq 8214824:8215044, ack 3817, win 501, length 220
2021-03-12 15:58:49.496003 IP 143.110.210.112.ssh > cpef81d0faec973-cmf81d0faec970.cpe.net.cable.rogers.com.49257: Flags [P.], seq 8215044:8215264, ack 3817, win 501, length 220
2021-03-12 15:58:49.496049 IP 143.110.210.112.ssh > cpef81d0faec973-cmf81d0faec970.cpe.net.cable.rogers.com.49257: Flags [P.], seq 8215264:8215484, ack 3817, win 501, length 220
2021-03-12 15:58:49.496111 IP 143.110.210.112.ssh > cpef81d0faec973-cmf81d0faec970.cpe.net.cable.rogers.com.49257: Flags [P.], seq 8215484:8215704, ack 3817, win 501, length 220
2021-03-12 15:58:49.496186 IP 143.110.210.112.ssh > cpef81d0faec973-cmf81d0faec970.cpe.net.cable.rogers.com.49257: Flags [P.], seq 8215704:8215924, ack 3817, win 501, length 220
2021-03-12 15:58:49.496250 IP 143.110.210.112.ssh > cpef81d0faec973-cmf81d0faec970.cpe.net.cable.rogers.com.49257: Flags [P.], seq 8215924:8216144, ack 3817, win 501, length 220
2021-03-12 15:58:49.496299 IP 143.110.210.112.ssh > cpef81d0faec973-cmf81d0faec970.cpe.net.cable.rogers.com.49257: Flags [P.], seq 8216144:8216364, ack 3817, win 501, length 220
2021-03-12 15:58:49.496372 IP 143.110.210.112.ssh > cpef81d0faec973-cmf81d0faec970.cpe.net.cable.rogers.com.49257: Flags [P.], seq 8216364:8216584, ack 3817, win 501, length 220
2021-03-12 15:58:49.496429 IP 143.110.210.112.ssh > cpef81d0faec973-cmf81d0faec970.cpe.net.cable.rogers.com.49257: Flags [P.], seq 8216584:8216804, ack 3817, win 501, length 220
2021-03-12 15:58:49.496470 IP 143.110.210.112.ssh > cpef81d0faec973-cmf81d0faec970.cpe.net.cable.rogers.com.49257: Flags [P.], seq 8216804:8217024, ack 3817, win 501, length 220
2021-03-12 15:58:49.496511 IP 143.110.210.112.ssh > cpef81d0faec973-cmf81d0faec970.cpe.net.cable.rogers.com.49257: Flags [P.], seq 8217024:8217244, ack 3817, win 501, length 220
2021-03-12 15:58:49.496549 IP 143.110.210.112.ssh > cpef81d0faec973-cmf81d0faec970.cpe.net.cable.rogers.com.49257: Flags [P.], seq 8217244:8217464, ack 3817, win 501, length 220
2021-03-12 15:58:49.496586 IP 143.110.210.112.ssh > cpef81d0faec973-cmf81d0faec970.cpe.net.cable.rogers.com.49257: Flags [P.], seq 8217464:8217684, ack 3817, win 501, length 220
2021-03-12 15:58:49.496626 IP 143.110.210.112.ssh > cpef81d0faec973-cmf81d0faec970.cpe.net.cable.rogers.com.49257: Flags [P.], seq 8217684:8217904, ack 3817, win 501, length 220
2021-03-12 15:58:49.496663 IP 143.110.210.112.ssh > cpef81d0faec973-cmf81d0faec970.cpe.net.cable.rogers.com.49257: Flags [P.], seq 8217904:8218124, ack 3817, win 501, length 220
2021-03-12 15:58:49.496703 IP 143.110.210.112.ssh > cpef81d0faec973-cmf81d0faec970.cpe.net.cable.rogers.com.49257: Flags [P.], seq 8218124:8218344, ack 3817, win 501, length 220
2021-03-12 15:58:49.496741 IP 143.110.210.112.ssh > cpef81d0faec973-cmf81d0faec970.cpe.net.cable.rogers.com.49257: Flags [P.], seq 8218344:8218564, ack 3817, win 501, length 220
2021-03-12 15:58:49.496778 IP 143.110.210.112.ssh > cpef81d0faec973-cmf81d0faec970.cpe.net.cable.rogers.com.49257: Flags [P.], seq 8218564:8218784, ack 3817, win 501, length 220
2021-03-12 15:58:49.496818 IP 143.110.210.112.ssh > cpef81d0faec973-cmf81d0faec970.cpe.net.cable.rogers.com.49257: Flags [P.], seq 8218784:8219004, ack 3817, win 501, length 220
2021-03-12 15:58:49.496856 IP 143.110.210.112.ssh > cpef81d0faec973-cmf81d0faec970.cpe.net.cable.rogers.com.49257: Flags [P.], seq 8219004:8219224, ack 3817, win 501, length 220
2021-03-12 15:58:49.496896 IP 143.110.210.112.ssh > cpef81d0faec973-cmf81d0faec970.cpe.net.cable.rogers.com.49257: Flags [P.], seq 8219224:8219444, ack 3817, win 501, length 220
2021-03-12 15:58:49.496933 IP 143.110.210.112.ssh > cpef81d0faec973-cmf81d0faec970.cpe.net.cable.rogers.com.49257: Flags [P.], seq 8219444:8219664, ack 3817, win 501, length 220
2021-03-12 15:58:49.496972 IP 143.110.210.112.ssh > cpef81d0faec973-cmf81d0faec970.cpe.net.cable.rogers.com.49257: Flags [P.], seq 8219664:8219884, ack 3817, win 501, length 220
2021-03-12 15:58:49.497012 IP 143.110.210.112.ssh > cpef81d0faec973-cmf81d0faec970.cpe.net.cable.rogers.com.49257: Flags [P.], seq 8219884:8220104, ack 3817, win 501, length 220
2021-03-12 15:58:49.497049 IP 143.110.210.112.ssh > cpef81d0faec973-cmf81d0faec970.cpe.net.cable.rogers.com.49257: Flags [P.], seq 8220104:8220324, ack 3817, win 501, length 220
2021-03-12 15:58:49.497088 IP 143.110.210.112.ssh > cpef81d0faec973-cmf81d0faec970.cpe.net.cable.rogers.com.49257: Flags [P.], seq 8220324:8220544, ack 3817, win 501, length 220
2021-03-12 15:58:49.497125 IP 143.110.210.112.ssh > cpef81d0faec973-cmf81d0faec970.cpe.net.cable.rogers.com.49257: Flags [P.], seq 8220544:8220764, ack 3817, win 501, length 220
2021-03-12 15:58:49.497178 IP 143.110.210.112.ssh > cpef81d0faec973-cmf81d0faec970.cpe.net.cable.rogers.com.49257: Flags [P.], seq 8220764:8220984, ack 3817, win 501, length 220
2021-03-12 15:58:49.497216 IP 143.110.210.112.ssh > cpef81d0faec973-cmf81d0faec970.cpe.net.cable.rogers.com.49257: Flags [P.], seq 8220984:8221068, ack 3817, win 501, length 84
2021-03-12 15:58:49.501366 IP cpef81d0faec973-cmf81d0faec970.cpe.net.cable.rogers.com.49257 > 143.110.210.112.ssh: Flags [.], ack 8127448, win 2005, length 0
2021-03-12 15:58:49.501408 IP cpef81d0faec973-cmf81d0faec970.cpe.net.cable.rogers.com.49257 > 143.110.210.112.ssh: Flags [.], ack 8138888, win 1960, length 0
2021-03-12 15:58:49.501443 IP cpef81d0faec973-cmf81d0faec970.cpe.net.cable.rogers.com.49257 > 143.110.210.112.ssh: Flags [.], ack 8140648, win 1953, length 0
2021-03-12 15:58:49.501448 IP cpef81d0faec973-cmf81d0faec970.cpe.net.cable.rogers.com.49257 > 143.110.210.112.ssh: Flags [.], ack 8144168, win 1939, length 0
2021-03-12 15:58:49.501457 IP cpef81d0faec973-cmf81d0faec970.cpe.net.cable.rogers.com.49257 > 143.110.210.112.ssh: Flags [.], ack 8145268, win 1935, length 0
2021-03-12 15:58:49.501461 IP cpef81d0faec973-cmf81d0faec970.cpe.net.cable.rogers.com.49257 > 143.110.210.112.ssh: Flags [.], ack 8145488, win 1934, length 0
2021-03-12 15:58:49.501463 IP cpef81d0faec973-cmf81d0faec970.cpe.net.cable.rogers.com.49257 > 143.110.210.112.ssh: Flags [.], ack 8151208, win 1912, length 0
2021-03-12 15:58:49.501477 IP cpef81d0faec973-cmf81d0faec970.cpe.net.cable.rogers.com.49257 > 143.110.210.112.ssh: Flags [.], ack 8153848, win 1901, length 0
2021-03-12 15:58:49.501483 IP cpef81d0faec973-cmf81d0faec970.cpe.net.cable.rogers.com.49257 > 143.110.210.112.ssh: Flags [.], ack 8159788, win 1878, length 0
2021-03-12 15:58:49.506699 IP cpef81d0faec973-cmf81d0faec970.cpe.net.cable.rogers.com.49257 > 143.110.210.112.ssh: Flags [.], ack 8163308, win 1864, length 0
2021-03-12 15:58:49.506742 IP cpef81d0faec973-cmf81d0faec970.cpe.net.cable.rogers.com.49257 > 143.110.210.112.ssh: Flags [.], ack 8165068, win 1858, length 0
2021-03-12 15:58:49.506750 IP cpef81d0faec973-cmf81d0faec970.cpe.net.cable.rogers.com.49257 > 143.110.210.112.ssh: Flags [.], ack 8168368, win 1845, length 0
2021-03-12 15:58:49.506756 IP cpef81d0faec973-cmf81d0faec970.cpe.net.cable.rogers.com.49257 > 143.110.210.112.ssh: Flags [.], ack 8174088, win 1822, length 0
2021-03-12 15:58:49.506767 IP cpef81d0faec973-cmf81d0faec970.cpe.net.cable.rogers.com.49257 > 143.110.210.112.ssh: Flags [.], ack 8182668, win 1789, length 0
2021-03-12 15:58:49.506786 IP cpef81d0faec973-cmf81d0faec970.cpe.net.cable.rogers.com.49257 > 143.110.210.112.ssh: Flags [.], ack 8184428, win 1782, length 0
2021-03-12 15:58:49.506790 IP cpef81d0faec973-cmf81d0faec970.cpe.net.cable.rogers.com.49257 > 143.110.210.112.ssh: Flags [.], ack 8184648, win 1781, length 0
2021-03-12 15:58:49.506793 IP cpef81d0faec973-cmf81d0faec970.cpe.net.cable.rogers.com.49257 > 143.110.210.112.ssh: Flags [.], ack 8185968, win 1776, length 0
2021-03-12 15:58:49.506797 IP cpef81d0faec973-cmf81d0faec970.cpe.net.cable.rogers.com.49257 > 143.110.210.112.ssh: Flags [.], ack 8186408, win 1774, length 0
2021-03-12 15:58:49.506799 IP cpef81d0faec973-cmf81d0faec970.cpe.net.cable.rogers.com.49257 > 143.110.210.112.ssh: Flags [.], ack 8187288, win 1771, length 0
2021-03-12 15:58:49.506804 IP cpef81d0faec973-cmf81d0faec970.cpe.net.cable.rogers.com.49257 > 143.110.210.112.ssh: Flags [.], ack 8190148, win 1760, length 0
2021-03-12 15:58:49.512277 IP cpef81d0faec973-cmf81d0faec970.cpe.net.cable.rogers.com.49257 > 143.110.210.112.ssh: Flags [.], ack 8190368, win 1759, length 0
2021-03-12 15:58:49.512341 IP cpef81d0faec973-cmf81d0faec970.cpe.net.cable.rogers.com.49257 > 143.110.210.112.ssh: Flags [.], ack 8190808, win 1757, length 0
2021-03-12 15:58:49.512347 IP cpef81d0faec973-cmf81d0faec970.cpe.net.cable.rogers.com.49257 > 143.110.210.112.ssh: Flags [.], ack 8191248, win 1755, length 0
2021-03-12 15:58:49.512352 IP cpef81d0faec973-cmf81d0faec970.cpe.net.cable.rogers.com.49257 > 143.110.210.112.ssh: Flags [.], ack 8191908, win 1753, length 0
2021-03-12 15:58:49.512358 IP cpef81d0faec973-cmf81d0faec970.cpe.net.cable.rogers.com.49257 > 143.110.210.112.ssh: Flags [.], ack 8192128, win 1752, length 0
2021-03-12 15:58:49.512361 IP cpef81d0faec973-cmf81d0faec970.cpe.net.cable.rogers.com.49257 > 143.110.210.112.ssh: Flags [.], ack 8194108, win 1744, length 0
2021-03-12 15:58:49.512369 IP cpef81d0faec973-cmf81d0faec970.cpe.net.cable.rogers.com.49257 > 143.110.210.112.ssh: Flags [.], ack 8194328, win 1743, length 0
2021-03-12 15:58:49.512374 IP cpef81d0faec973-cmf81d0faec970.cpe.net.cable.rogers.com.49257 > 143.110.210.112.ssh: Flags [.], ack 8196088, win 1736, length 0
2021-03-12 15:58:49.512381 IP cpef81d0faec973-cmf81d0faec970.cpe.net.cable.rogers.com.49257 > 143.110.210.112.ssh: Flags [.], ack 8198288, win 1728, length 0
2021-03-12 15:58:49.512386 IP cpef81d0faec973-cmf81d0faec970.cpe.net.cable.rogers.com.49257 > 143.110.210.112.ssh: Flags [.], ack 8199828, win 1722, length 0
2021-03-12 15:58:49.512394 IP cpef81d0faec973-cmf81d0faec970.cpe.net.cable.rogers.com.49257 > 143.110.210.112.ssh: Flags [.], ack 8203348, win 1708, length 0
2021-03-12 15:58:49.512404 IP cpef81d0faec973-cmf81d0faec970.cpe.net.cable.rogers.com.49257 > 143.110.210.112.ssh: Flags [.], ack 8205108, win 1701, length 0
2021-03-12 15:58:49.512411 IP cpef81d0faec973-cmf81d0faec970.cpe.net.cable.rogers.com.49257 > 143.110.210.112.ssh: Flags [.], ack 8208028, win 1690, length 0
2021-03-12 15:58:49.512416 IP cpef81d0faec973-cmf81d0faec970.cpe.net.cable.rogers.com.49257 > 143.110.210.112.ssh: Flags [.], ack 8208664, win 1687, length 0
2021-03-12 15:58:49.512419 IP cpef81d0faec973-cmf81d0faec970.cpe.net.cable.rogers.com.49257 > 143.110.210.112.ssh: Flags [.], ack 8209764, win 1683, length 0
2021-03-12 15:58:49.512425 IP cpef81d0faec973-cmf81d0faec970.cpe.net.cable.rogers.com.49257 > 143.110.210.112.ssh: Flags [.], ack 8210864, win 1679, length 0
2021-03-12 15:58:49.519177 IP cpef81d0faec973-cmf81d0faec970.cpe.net.cable.rogers.com.49257 > 143.110.210.112.ssh: Flags [.], ack 8220104, win 1643, length 0
